{
  "schemaVersion": "1.0.0",
  "planId": "ENGPLAN-EVT-20260823-001",
  "workstreamId": "WS-02",
  "ownerRole": "ENG-02",
  "producerActorId": "actor-eng-02",
  "status": "completed",
  "verificationDisposition": "not_applicable",
  "implementationRevision": "ae9b6d4658bc46e8e04d59dc2faef0f5994c29d7",
  "changedComponents": [
    "docs/architecture/system-architecture.md",
    "docs/architecture/ADR-001-platform-and-persistence.md",
    "docs/architecture/ADR-002-state-and-concurrency.md",
    "docs/architecture/ADR-003-provider-adapters.md"
  ],
  "commands": [
    "git diff --check",
    "rg architecture control terms in docs",
    "development-cli validate ."
  ],
  "evidence": [
    "docs/architecture/system-architecture.md",
    "docs/architecture/ADR-001-platform-and-persistence.md",
    "docs/architecture/ADR-002-state-and-concurrency.md",
    "docs/architecture/ADR-003-provider-adapters.md",
    "Development OS validation passed for 23 managed files",
    "Git revision ae9b6d4658bc46e8e04d59dc2faef0f5994c29d7"
  ],
  "knownRisks": [
    "D1 concurrency behavior must be proven by integration tests before claiming atomic booking.",
    "Production provider activation remains gated and synthetic adapters do not prove an external contract.",
    "The source gown tier overlap at quantity 6 uses an explicit temporary first-match policy pending a controlled product correction."
  ],
  "completedAt": "2026-08-23T14:13:12.828Z"
}
